title,artist,album,cover,file
Blame,"Calvin Harris, John Newman",Motion,motion.jpeg,blame.mp3
Outside,"Calvin Harris, Ellie Goulding",Motion,motion.jpeg,outside.mp3
Feel So Close,Calvin Harris,18 Months,18_months.jpeg,feel_so_close.mp3
Summer,Calvin Harris,Motion,motion.jpeg,summer.mp3
One Kiss,"Calvin Harris, Dua Lipa",One Kiss (with Dua Lipa),one_kiss_with_dua_lipa.jpeg,one_kiss.mp3
This Is What You Came For,"Calvin Harris, Rihanna",This Is What You Came For,this_is_what_you_came_for.jpeg,this_is_what_you_came_for.mp3
How Deep Is Your Love,"Calvin Harris, Disciples",How Deep Is Your Love,how_deep_is_your_love.jpeg,how_deep_is_your_love_2.mp3
